{
 "kind": "review-record",
 "schema_version": "1",
 "date": "2026-09-27",
 "target": "chorus PR #32 and coryphaeus",
 "mode": "pr-design",
 "round_context": "Design review of chorus PR #32 (branch suite-review/integration; about 40 files, +1.4k/−2.2k against main) and the new coryphaeus repository. Deltas: seven declared ports in CONDUCTOR; persona replies and records as JSON checked by coryphaeus's validator; mandates removed and the cap of five on every board; seating and the deferral checklist moved into DECISION-PRIMITIVE; three-level severity and six settled vote-count cases; the review procedure rewritten with INTEGRATION-LAYER folded in; persona files reworked; plugin packaging, install manifest, integrity checks and CI; coryphaeus schemas, validator, renderer and port bindings. Out of scope: specs/, tests/parity/, older reviews.",
 "register": [
  {
   "id": "F1",
   "author": "mark-richards-architect",
   "lens": "architecture",
   "authored_severity": "🔴",
   "locator": "skill/chorus-core/GATE-PRIMITIVE.md:207-240",
   "pull_quote": "Two authors of the vote rule, and no alarm when they disagree.",
   "evidence": [
    {
     "kind": "file_line",
     "ref": "skill/chorus-core/GATE-PRIMITIVE.md:207-240",
     "note": "The rule and six settled cases, in prose."
    },
    {
     "kind": "file_line",
     "ref": "coryphaeus/bin/validate.mjs:172-183",
     "note": "tally() re-authors the same arithmetic."
    },
    {
     "kind": "file_line",
     "ref": "coryphaeus/test/validate.test.mjs:39-43",
     "note": "Cases copied by hand; GATE-PRIMITIVE is never read."
    },
    {
     "kind": "file_line",
     "ref": ".specify/memory/constitution.md:87",
     "note": "A tally rule appearing outside its canon doc is named as the smell."
    }
   ],
   "confidence_on_hand": "high",
   "need_info": false,
   "graded": true
  },
  {
   "id": "F2",
   "author": "mark-richards-architect",
   "lens": "architecture",
   "authored_severity": "🟡",
   "locator": "skill/chorus-core/CONDUCTOR.md:270-278",
   "pull_quote": "The port contract is written twice and already reads two ways.",
   "evidence": [
    {
     "kind": "file_line",
     "ref": "skill/chorus-core/CONDUCTOR.md:274"
    },
    {
     "kind": "file_line",
     "ref": "skill/chorus-core/CONDUCTOR.md:278"
    },
    {
     "kind": "file_line",
     "ref": "coryphaeus/SKILL.md:53-61",
     "note": "Its column is labelled Default (nothing bound) but it lists the bindings."
    }
   ],
   "confidence_on_hand": "high",
   "need_info": false,
   "graded": true,
   "convergence_notes": [
    {
     "persona": "eric-evans-advisor",
     "pull_quote": "The port table exists twice and means two things by 'unbound'."
    },
    {
     "persona": "alan-cooper-advisor",
     "pull_quote": "One contract, one table."
    },
    {
     "persona": "don-norman-advisor",
     "pull_quote": "Whichever table the operator reads first becomes their model of what runs."
    }
   ]
  },
  {
   "id": "F3",
   "author": "mark-richards-architect",
   "lens": "architecture",
   "authored_severity": "🟡",
   "locator": "skill/chorus-review/SKILL.md:159-172",
   "pull_quote": "The provider is re-deciding a rule the chorus owns.",
   "evidence": [
    {
     "kind": "file_line",
     "ref": "skill/chorus-review/SKILL.md:159-172"
    },
    {
     "kind": "file_line",
     "ref": "coryphaeus/SKILL.md:42-44"
    }
   ],
   "confidence_on_hand": "high",
   "need_info": false,
   "graded": true,
   "convergence_notes": [
    {
     "persona": "alan-cooper-advisor",
     "pull_quote": "Decide the retry once, in the chorus."
    },
    {
     "persona": "don-norman-advisor",
     "pull_quote": "One rule owned in one place is also one story told to the user."
    }
   ]
  },
  {
   "id": "F4",
   "author": "mark-richards-architect",
   "lens": "architecture",
   "authored_severity": "🟡",
   "locator": "coryphaeus/schema/finding-report.schema.json",
   "pull_quote": "A schema bump would read as ten abstentions, not as a version mismatch.",
   "evidence": [
    {
     "kind": "file_line",
     "ref": "coryphaeus/schema/finding-report.schema.json:11",
     "note": "schema_version const '1'."
    },
    {
     "kind": "file_line",
     "ref": "skill/chorus-core/CONDUCTOR.md:274",
     "note": "'the bound schema', with no version."
    },
    {
     "kind": "file_line",
     "ref": "coryphaeus/install.sh:1-26",
     "note": "Plain copy, nothing versioned."
    }
   ],
   "confidence_on_hand": "high",
   "need_info": false,
   "graded": true,
   "convergence_notes": [
    {
     "persona": "security-and-trust-advisor",
     "pull_quote": "A version mismatch has to name itself, or it blames the personas."
    },
    {
     "persona": "alan-cooper-advisor",
     "pull_quote": "A version mismatch is blamed on the personas, and the advice is to wait."
    },
    {
     "persona": "don-norman-advisor",
     "pull_quote": "A version bump shows up as a row of abstentions, and the operator will look for the fault in the personas."
    }
   ]
  },
  {
   "id": "F5",
   "author": "mark-richards-architect",
   "lens": "architecture",
   "authored_severity": "🟡",
   "locator": ".github/workflows/integrity.yml:1-25",
   "pull_quote": "The rule-checking program itself goes unchecked.",
   "evidence": [
    {
     "kind": "file_line",
     "ref": ".github/workflows/integrity.yml:1-25"
    },
    {
     "kind": "file_line",
     "ref": ".specify/memory/constitution.md:306-310"
    },
    {
     "kind": "file_line",
     "ref": "install.sh:1",
     "note": "No mention of coryphaeus or node."
    }
   ],
   "confidence_on_hand": "high",
   "need_info": false,
   "graded": true
  },
  {
   "id": "F6",
   "author": "mark-richards-architect",
   "lens": "architecture",
   "authored_severity": "🟢",
   "locator": ".specify/memory/constitution.md:321-324",
   "pull_quote": "The direction is right today, and nothing keeps it right tomorrow.",
   "evidence": [
    {
     "kind": "file_line",
     "ref": ".specify/memory/constitution.md:321-324"
    },
    {
     "kind": "file_line",
     "ref": "scripts/check-suite-integrity.sh:6-13",
     "note": "FC1-FC5 do not cover it."
    }
   ],
   "confidence_on_hand": "high",
   "need_info": false,
   "graded": true
  },
  {
   "id": "F7",
   "author": "mark-richards-architect",
   "lens": "architecture",
   "authored_severity": "🟢",
   "locator": ".claude-plugin/plugin.json:4-8",
   "pull_quote": "The manifest describes the previous version of the suite.",
   "evidence": [
    {
     "kind": "file_line",
     "ref": ".claude-plugin/plugin.json:4-8"
    }
   ],
   "confidence_on_hand": "high",
   "need_info": false,
   "graded": true,
   "convergence_notes": [
    {
     "persona": "alan-cooper-advisor",
     "pull_quote": "Every surface the user reads first still describes the old artifact."
    }
   ]
  },
  {
   "id": "F8",
   "author": "mark-richards-architect",
   "lens": "architecture",
   "authored_severity": "🟡",
   "locator": "skill/chorus-core/CONDUCTOR.md:266-282",
   "pull_quote": "The right trade, as long as the drift alarms ship with it.",
   "evidence": [
    {
     "kind": "file_line",
     "ref": "skill/chorus-core/CONDUCTOR.md:266-282"
    },
    {
     "kind": "file_line",
     "ref": "coryphaeus/SKILL.md:29-37"
    }
   ],
   "confidence_on_hand": "high",
   "need_info": false,
   "graded": true
  },
  {
   "id": "F9",
   "author": "security-and-trust-advisor",
   "lens": "security",
   "authored_severity": "🟡",
   "locator": "skill/chorus-review/SKILL.md:164-166",
   "pull_quote": "The memory folder is a back door past the validator.",
   "evidence": [
    {
     "kind": "file_line",
     "ref": "skill/chorus-review/SKILL.md:164-166",
     "note": "'Read any new files there: they are the report.'"
    },
    {
     "kind": "file_line",
     "ref": "skill/chorus-review/SKILL.md:167-172",
     "note": "Replies are checked by the validator before they count."
    },
    {
     "kind": "file_line",
     "ref": "skill/chorus-core/EXPLORATORY-PHASE.md:105-107",
     "note": "Memory is an index, never the evidentiary endpoint."
    }
   ],
   "confidence_on_hand": "high",
   "need_info": false,
   "graded": true,
   "convergence_notes": [
    {
     "persona": "mark-richards-architect",
     "pull_quote": "The memory folder is a second report channel, and it skips the gate."
    }
   ]
  },
  {
   "id": "F10",
   "author": "security-and-trust-advisor",
   "lens": "security",
   "authored_severity": "🟡",
   "locator": "skill/chorus-core/CONDUCTOR.md:406-427",
   "pull_quote": "A filter that never ran now reads as zero drops.",
   "evidence": [
    {
     "kind": "file_line",
     "ref": "coryphaeus/bin/render.mjs:189",
     "note": "secret_drops ?? 0"
    },
    {
     "kind": "file_line",
     "ref": "coryphaeus/schema/sdlc-log.schema.json:154",
     "note": "Optional integer, self-reported."
    },
    {
     "kind": "file_line",
     "ref": "skill/chorus-core/CONDUCTOR.md:424-426",
     "note": "'No runtime: the skill has none'."
    },
    {
     "kind": "file_line",
     "ref": ".specify/memory/constitution.md:306-309",
     "note": "Programs now live outside the canon."
    }
   ],
   "confidence_on_hand": "high",
   "need_info": false,
   "graded": true,
   "convergence_notes": [
    {
     "persona": "don-norman-advisor",
     "pull_quote": "A filter that never ran is reported as a clean pass, so the page itself is wrong."
    }
   ]
  },
  {
   "id": "F11",
   "author": "security-and-trust-advisor",
   "lens": "security",
   "authored_severity": "🟡",
   "locator": "skill/chorus-core/CONDUCTOR.md:274",
   "pull_quote": "A missing validator fails quietly or blames the wrong party.",
   "evidence": [
    {
     "kind": "file_line",
     "ref": "coryphaeus/install.sh:14",
     "note": "Missing node is only a warning."
    },
    {
     "kind": "file_line",
     "ref": "coryphaeus/bin/validate.mjs:540",
     "note": "Exit contract is 0/1/2 only."
    },
    {